{
  "$schema": "https://not-stbenjam.github.io/ramen-bench/schemas/run.schema.json",
  "schemaVersion": 1,
  "id": "anthropic/sonnet-5.5/max",
  "vendor": {
    "slug": "anthropic",
    "displayName": "Anthropic"
  },
  "model": {
    "slug": "sonnet-5.5",
    "displayName": "Sonnet 5.5",
    "providerModelId": "claude-sonnet-5-5"
  },
  "variation": {
    "slug": "max",
    "displayName": "Max",
    "reasoningEffort": "max",
    "parameters": {}
  },
  "harness": {
    "name": "Claude Code",
    "version": "2.1.283",
    "runtime": "Anthropic Claude Code CLI",
    "invocation": "Claude Code session using claude-sonnet-5-5; effort max; --safe-mode --print --permission-mode acceptEdits --tools Read,Write,Edit --strict-mcp-config --output-format stream-json --verbose"
  },
  "artifacts": {
    "result": "index.html",
    "transcript": "transcript.json"
  },
  "timing": {
    "startedAt": "2026-09-28T19:05:06.971Z",
    "completedAt": "2026-09-28T20:24:33.581Z",
    "wallDurationMs": 4766610,
    "apiDurationMs": 4766054
  },
  "usage": {
    "tokens": {
      "input": 5763,
      "cachedInput": 1787375,
      "cacheCreationInput": 417291,
      "reasoning": 576542,
      "output": 638374,
      "total": 2848803
    },
    "cost": {
      "currency": "USD",
      "input": 0.008728,
      "output": 6.38359,
      "cachedInput": 0.357475,
      "cacheCreationInput": 1.669164,
      "other": 0.001474,
      "total": 8.420431,
      "estimated": true
    },
    "requests": 25,
    "turns": 1,
    "toolCalls": 29,
    "providerReported": true,
    "raw": {
      "source": "Claude Code final cost-state",
      "requestCountBasis": "unique recorded assistant message ids",
      "costState": {
        "totalCostUSD": 16.458738,
        "totalAPIDurationMs": 4766054,
        "totalDurationMs": 4767758,
        "startTimeEpochMs": 1790622305863,
        "hasUnknownModelCost": true,
        "modelUsage": {
          "claude-haiku-4-5-20251001": {
            "inputTokens": 1399,
            "outputTokens": 15,
            "thinkingTokens": 0,
            "cacheReadInputTokens": 0,
            "cacheCreationInputTokens": 0,
            "webSearchRequests": 0,
            "costUSD": 0.001474
          },
          "claude-sonnet-5-5": {
            "inputTokens": 4364,
            "outputTokens": 638359,
            "thinkingTokens": 576542,
            "cacheReadInputTokens": 1787375,
            "cacheCreationInputTokens": 417291,
            "webSearchRequests": 0,
            "costUSD": 16.457264
          }
        }
      },
      "listPriceCalculation": {
        "source": "https://platform.claude.com/docs/en/models/sonnet-5-5/overview",
        "asOf": "2026-09-30",
        "usdPerMillionTokens": {
          "input": 2,
          "output": 10,
          "cacheRead": 0.2,
          "cacheWrite5m": 2.5,
          "cacheWrite1h": 4
        },
        "cacheWrite5mTokens": 0,
        "cacheWrite1hTokens": 409566,
        "cacheWriteUnclassifiedTokens": 7725,
        "unclassifiedCacheWriteTreatment": "upper tariff bound; duration unknown",
        "totalRangeUsd": [
          8.4088435,
          8.420431
        ],
        "auxiliaryCostSource": "recorded Claude Code Haiku costUSD",
        "thinkingIncludedInOutput": true
      }
    }
  },
  "resultStats": {
    "bytes": 65073,
    "lines": 1393
  },
  "provenance": {
    "pricingSource": "Anthropic official list prices as of 2026-09-30: https://platform.claude.com/docs/en/models/sonnet-5-5/overview"
  },
  "notes": "Token totals are the exact final Claude Code cost-state totals, including harness auxiliary requests. Cost is estimated at published Sonnet 5.5 list prices, with recorded cache durations and recorded auxiliary Haiku cost. Unclassified cache writes use the upper tariff bound; the exact range is retained in listPriceCalculation. Thinking is already included in output. The public transcript omits hidden thinking, private agent-mail activity, credentials, and private local path prefixes. The result matches its recorded file-operation replay (18 operations)."
}
