{
  "$schema": "../../../schemas/run.schema.json",
  "schemaVersion": 1,
  "id": "meta/muse-wonder-1.0/minimal",
  "vendor": {
    "slug": "meta",
    "displayName": "Meta"
  },
  "model": {
    "slug": "muse-wonder-1.0",
    "displayName": "Muse Wonder",
    "providerModelId": "muse-wonder-1.0"
  },
  "variation": {
    "slug": "minimal",
    "displayName": "Minimal",
    "reasoningEffort": "minimal",
    "parameters": {
      "effortSource": "Native Harbor kwargs and recorded Muse CLI invocation"
    }
  },
  "harness": {
    "name": "Muse Code",
    "version": "1.4.6",
    "runtime": "Harbor",
    "invocation": "Native Harbor Muse Code with pinned executable; muse-wonder-1.0 @ minimal"
  },
  "artifacts": {
    "result": "index.html",
    "transcript": "transcript.json"
  },
  "timing": {
    "startedAt": "2026-10-12T19:53:21.374934Z",
    "completedAt": "2026-10-12T19:54:16.575085Z",
    "wallDurationMs": 55200,
    "apiDurationMs": 55399
  },
  "usage": {
    "tokens": {
      "input": 51690,
      "cachedInput": 138308,
      "cacheCreationInput": 0,
      "output": 8711,
      "reasoning": 838,
      "total": 199547
    },
    "cost": null,
    "requests": 7,
    "turns": 1,
    "toolCalls": 5,
    "providerReported": true,
    "raw": {
      "mainSessionTokens": {
        "input_tokens": 174952,
        "cached_tokens": 135248,
        "cache_read_tokens": 135248,
        "cache_write_tokens": 0,
        "output_tokens": 7681,
        "reasoning_tokens": 140
      },
      "auxiliarySessions": [
        {
          "sessionId": "2743be3e-83d9-4f2f-9404-97eae919ff24",
          "modelCompletedTotals": {
            "input_tokens": 8737,
            "cached_tokens": 0,
            "cache_read_tokens": 0,
            "cache_write_tokens": 0,
            "output_tokens": 298,
            "reasoning_tokens": 167
          },
          "requests": 1
        },
        {
          "sessionId": "2cae2c4a-3507-48f5-9015-eeb13df0f74f",
          "modelCompletedTotals": {
            "input_tokens": 6309,
            "cached_tokens": 3060,
            "cache_read_tokens": 3060,
            "cache_write_tokens": 0,
            "output_tokens": 732,
            "reasoning_tokens": 531
          },
          "requests": 1
        }
      ],
      "modelCompletedTotals": {
        "input_tokens": 189998,
        "cached_tokens": 138308,
        "cache_read_tokens": 138308,
        "cache_write_tokens": 0,
        "output_tokens": 8711,
        "reasoning_tokens": 838
      },
      "terminal": {
        "eot_gate_ms": 5805,
        "kind": "terminal",
        "reason": null,
        "terminal": "completed",
        "time_to_first_token_ms": 45925,
        "turn_duration_ms": 53573
      },
      "harborTrial": "muse-task__HoeLgX2",
      "harborTaskChecksum": "27d7e1ec9b16b2569900f0cf4558f1351f0de6b3f39af360b3371ec229987f6c",
      "artifactVerification": "Recorded Muse file-operation replay (1 operations)",
      "nativeExportDiagnostics": {
        "duplicate_records": 0,
        "gaps": 3,
        "omitted_live_only": 3,
        "unknown_payload_kinds": 0,
        "unparseable_lines": 0
      },
      "harborGradeTrial": "muse-task__KqbC4eB"
    }
  },
  "resultStats": {
    "bytes": 16697,
    "lines": 384
  },
  "notes": "HTML is unchanged and verified against recorded Muse writes. Generation timing excludes setup and grading. Tokens sum native model_completed events once per retained main and auxiliary session; input excludes cache hits and reasoning is separate from output. Auxiliary session content, hidden reasoning, system/developer prompts and private activity are excluded from the public transcript. Muse supplies no recorded cost, and the pinned LiteLLM catalog has no Wonder rate; cost remains unknown. Effort is the explicitly requested setting recorded in Harbor and its Muse invocation. Scores come from a native Harbor regrade of the saved artifact; generation was not repeated."
}
