{
  "$schema": "../../../schemas/run.schema.json",
  "schemaVersion": 1,
  "id": "meta/muse-wonder-full-1.0/max",
  "vendor": {
    "slug": "meta",
    "displayName": "Meta"
  },
  "model": {
    "slug": "muse-wonder-full-1.0",
    "displayName": "Muse Wonder Full",
    "providerModelId": "muse-wonder-full-1.0"
  },
  "variation": {
    "slug": "max",
    "displayName": "Max",
    "reasoningEffort": "max",
    "parameters": {
      "effortSource": "Native Harbor kwargs and recorded Muse CLI invocation"
    }
  },
  "harness": {
    "name": "Muse Code",
    "version": "1.4.7",
    "runtime": "Harbor",
    "invocation": "Native Harbor Muse Code with pinned executable; muse-wonder-full-1.0 @ max"
  },
  "artifacts": {
    "result": "index.html",
    "transcript": "transcript.json"
  },
  "timing": {
    "startedAt": "2026-10-13T04:36:19.154733Z",
    "completedAt": "2026-10-13T04:42:41.167698Z",
    "wallDurationMs": 382013,
    "apiDurationMs": 384596
  },
  "usage": {
    "tokens": {
      "input": 111450,
      "cachedInput": 1354568,
      "cacheCreationInput": 0,
      "output": 16153,
      "reasoning": 8483,
      "total": 1490654
    },
    "cost": null,
    "requests": 29,
    "turns": 1,
    "toolCalls": 26,
    "providerReported": true,
    "raw": {
      "mainSessionTokens": {
        "input_tokens": 1424130,
        "cached_tokens": 1354568,
        "cache_read_tokens": 1354568,
        "cache_write_tokens": 0,
        "output_tokens": 23680,
        "reasoning_tokens": 7856
      },
      "auxiliarySessions": [
        {
          "sessionId": "a3596a97-fdf5-48cc-89b7-f732057fa183",
          "modelCompletedTotals": {
            "input_tokens": 11218,
            "cached_tokens": 0,
            "cache_read_tokens": 0,
            "cache_write_tokens": 0,
            "output_tokens": 790,
            "reasoning_tokens": 582
          },
          "requests": 1
        },
        {
          "sessionId": "c636fbde-0770-4c52-b644-db924d5ef5e1",
          "modelCompletedTotals": {
            "input_tokens": 30670,
            "cached_tokens": 0,
            "cache_read_tokens": 0,
            "cache_write_tokens": 0,
            "output_tokens": 166,
            "reasoning_tokens": 45
          },
          "requests": 1
        }
      ],
      "modelCompletedTotals": {
        "input_tokens": 1466018,
        "cached_tokens": 1354568,
        "cache_read_tokens": 1354568,
        "cache_write_tokens": 0,
        "output_tokens": 24636,
        "reasoning_tokens": 8483
      },
      "terminal": {
        "eot_gate_ms": 12158,
        "kind": "terminal",
        "reason": null,
        "terminal": "completed",
        "time_to_first_token_ms": 8240,
        "turn_duration_ms": 380880
      },
      "harborTrial": "muse-task__zVBaEMX",
      "harborTaskChecksum": "27d7e1ec9b16b2569900f0cf4558f1351f0de6b3f39af360b3371ec229987f6c",
      "artifactVerification": "Recorded Muse file-operation replay (15 operations)",
      "nativeExportDiagnostics": {
        "duplicate_records": 0,
        "gaps": 14,
        "omitted_live_only": 14,
        "unknown_payload_kinds": 0,
        "unparseable_lines": 0
      }
    }
  },
  "resultStats": {
    "bytes": 28310,
    "lines": 582
  },
  "provenance": {},
  "notes": "HTML is unchanged and verified against recorded Muse writes. Generation timing excludes setup and grading. Tokens sum native model_completed events once per retained main and auxiliary session. Input excludes cache hits; reasoning is a subset of native output, split out of usage.tokens.output and counted once in the total. Auxiliary session content, hidden reasoning, system/developer prompts and private activity are excluded from the public transcript. Wonder Full is subscription-only and has no published per-token rate; cost is unknown. Effort is the explicitly requested setting recorded in Harbor and its Muse invocation."
}
