{
  "$schema": "https://not-stbenjam.github.io/ramen-bench/schemas/run.schema.json",
  "schemaVersion": 1,
  "id": "openai/gpt-5.6-sol/high",
  "vendor": {
    "slug": "openai",
    "displayName": "OpenAI"
  },
  "model": {
    "slug": "gpt-5.6-sol",
    "displayName": "GPT 5.6 Sol",
    "providerModelId": "gpt-5.6-sol"
  },
  "variation": {
    "slug": "high",
    "displayName": "High",
    "reasoningEffort": "high",
    "parameters": {}
  },
  "harness": {
    "name": "Codex CLI",
    "version": "0.153.2",
    "runtime": "OpenAI Codex CLI",
    "invocation": "codex exec --ephemeral --model gpt-5.6-sol --config model_reasoning_effort=high PROMPT.md"
  },
  "artifacts": {
    "result": "index.html",
    "transcript": "transcript.json"
  },
  "timing": {
    "startedAt": "2026-09-04T22:23:38.976Z",
    "completedAt": "2026-09-04T22:27:26.519Z",
    "wallDurationMs": 227543
  },
  "usage": {
    "tokens": {
      "input": 0,
      "cachedInput": 0,
      "cacheCreationInput": 0,
      "reasoning": 0,
      "output": 0,
      "total": 40828
    },
    "cost": {
      "currency": "USD",
      "input": 0.011428,
      "cachedInput": 0.0145728,
      "cacheCreationInput": 0.0,
      "output": 0.03078,
      "total": 0.0567808,
      "estimated": true
    },
    "turns": 1,
    "toolCalls": 8,
    "providerReported": true,
    "raw": {
      "source": "Codex terminal tokens used summary",
      "totalTokens": 40828,
      "tokenCategoryBreakdownAvailable": false,
      "pricing": {
        "library": "litellm",
        "version": "1.83.7",
        "modelKey": "gpt-5.6-sol",
        "ratesUsdPerToken": {
          "input": 4e-06,
          "cachedInput": 4e-07,
          "cacheCreationInput": 5e-06,
          "output": 2e-05
        }
      },
      "costCalculation": {
        "status": "estimated_from_total_tokens",
        "exactTotalTokens": 40828,
        "referenceRunId": "openai/gpt-6-astra/high",
        "referenceRationale": "same Codex harness, task, date, and reasoning effort with recorded token categories",
        "estimatedTokenAllocation": {
          "input": 39289,
          "cachedInput": 36432,
          "cacheCreationInput": 0,
          "reasoning": 263,
          "output": 1539,
          "total": 40828
        },
        "inputIncludesCachedInput": true
      }
    }
  },
  "resultStats": {
    "bytes": 21267,
    "lines": 574
  },
  "provenance": {
    "pricingSource": "LiteLLM 1.83.7 model_cost[gpt-5.6-sol]; token allocation estimated from openai/gpt-6-astra/high"
  },
  "notes": "The Codex terminal record reports an exact total token count without category breakdown. Cost was estimated with this model's LiteLLM rates after allocating that total using the same-effort GPT 6 Astra run's recorded input, cache, and output proportions; the exact total token field is unchanged. The public transcript contains recorded text and full recorded tool activity; hidden reasoning, credentials, and private local path prefixes are excluded."
}
