{
  "$schema": "https://not-stbenjam.github.io/ramen-bench/schemas/run.schema.json",
  "schemaVersion": 1,
  "id": "openai/gpt-6-sol/high",
  "vendor": {
    "slug": "openai",
    "displayName": "OpenAI"
  },
  "model": {
    "slug": "gpt-6-sol",
    "displayName": "GPT 6 Sol",
    "providerModelId": "gpt-6-sol"
  },
  "variation": {
    "slug": "high",
    "displayName": "High",
    "reasoningEffort": "high",
    "parameters": {}
  },
  "harness": {
    "name": "Codex CLI",
    "version": "0.155.1",
    "runtime": "OpenAI Codex CLI",
    "invocation": "Codex CLI session using gpt-6-sol; reasoning effort high"
  },
  "artifacts": {
    "result": "index.html",
    "transcript": "transcript.json"
  },
  "timing": {
    "startedAt": "2026-09-22T23:18:45.986Z",
    "completedAt": "2026-09-22T23:24:17.198Z",
    "wallDurationMs": 331212
  },
  "usage": {
    "tokens": {
      "input": 624474,
      "cachedInput": 588416,
      "cacheCreationInput": 0,
      "reasoning": 3262,
      "output": 16965,
      "total": 641439
    },
    "cost": {
      "currency": "USD",
      "input": 0.072116,
      "cachedInput": 0.1176832,
      "cacheCreationInput": 0.0,
      "output": 0.16965,
      "total": 0.3594492,
      "estimated": true
    },
    "requests": 17,
    "turns": 1,
    "toolCalls": 16,
    "providerReported": true,
    "raw": {
      "source": "Codex final cumulative thread_token_usage",
      "codexThreadTokenUsage": {
        "input_tokens": 624474,
        "cached_input_tokens": 588416,
        "cache_write_input_tokens": 0,
        "output_tokens": 16965,
        "reasoning_output_tokens": 3262,
        "total_tokens": 641439
      },
      "pricing": {
        "library": "litellm",
        "version": "1.83.7",
        "modelKey": "gpt-6-sol",
        "ratesUsdPerToken": {
          "input": 2e-06,
          "cachedInput": 2e-07,
          "cacheCreationInput": 2.5e-06,
          "output": 1e-05
        }
      },
      "costCalculation": {
        "uncachedInputTokens": 36058,
        "cachedInputIsSubsetOfInput": true
      }
    }
  },
  "resultStats": {
    "bytes": 27647,
    "lines": 470
  },
  "provenance": {
    "pricingSource": "LiteLLM 1.83.7 model_cost[gpt-6-sol]"
  },
  "notes": "Codex recorded exact cumulative token categories. Cost was calculated from LiteLLM rates; cached input is a subset of Codex's input total. The public transcript omits hidden reasoning, private agent-mail activity, credentials, and private local path prefixes. The result matches its recorded file-operation replay (7 operations)."
}
