{
  "$schema": "../../../schemas/run.schema.json",
  "schemaVersion": 1,
  "id": "meta/muse-spark-1.3/medium",
  "vendor": {
    "slug": "meta",
    "displayName": "Meta"
  },
  "model": {
    "slug": "muse-spark-1.3",
    "displayName": "Muse Spark 1.3",
    "providerModelId": "muse-spark-1.3-contributor"
  },
  "variation": {
    "slug": "medium",
    "displayName": "Medium",
    "reasoningEffort": "medium"
  },
  "harness": {
    "name": "Muse Code",
    "version": "1.0.3 (238bb03ff3)"
  },
  "artifacts": {
    "result": "index.html",
    "transcript": "transcript.json"
  },
  "timing": {
    "startedAt": "2026-09-05T01:21:29.871842Z",
    "completedAt": "2026-09-05T01:24:12.325842Z",
    "wallDurationMs": 162454,
    "apiDurationMs": 93269
  },
  "usage": {
    "tokens": {
      "input": 45212,
      "cachedInput": 312456,
      "cacheCreationInput": 0,
      "reasoning": 2041,
      "output": 11059,
      "total": 370768
    },
    "cost": {
      "currency": "USD",
      "input": 0.0045212,
      "cachedInput": 0.000624912,
      "cacheCreationInput": 0,
      "output": 0.00262,
      "other": 0,
      "total": 0.007766112,
      "estimated": true
    },
    "requests": 9,
    "turns": 1,
    "toolCalls": 8,
    "providerReported": true,
    "raw": {
      "modelCompletedTotals": {
        "input_tokens": 357668,
        "cached_tokens": 312456,
        "cache_read_tokens": 312456,
        "cache_write_tokens": 0,
        "output_tokens": 11059,
        "reasoning_tokens": 2041
      },
      "terminal": {
        "eot_gate_ms": 18262,
        "kind": "terminal",
        "reason": null,
        "terminal": "completed",
        "time_to_first_token_ms": 4549,
        "turn_duration_ms": 162454
      },
      "pricing": {
        "library": "LiteLLM",
        "version": "1.83.7",
        "modelKey": "meta/muse-spark-1.3-contributor",
        "inputCostPerToken": 1e-07,
        "cachedInputCostPerToken": 2e-09,
        "outputCostPerToken": 2e-07,
        "reasoningCostPerToken": 2e-07
      }
    }
  },
  "resultStats": {
    "bytes": 19519,
    "lines": 472
  },
  "provenance": {
    "generatedAt": "2026-09-05T02:07:46.692319Z",
    "sourceCommit": "5292b3628a7d42cf2729731510ccca8a3fe90d79",
    "pricingSource": "LiteLLM 1.83.7 model_cost['meta/muse-spark-1.3-contributor']"
  },
  "notes": "Token counts and durations are exact sums of Muse Code model_completed events and the completed terminal event. Provider input includes cache hits; usage.tokens.input is the uncached remainder. Estimated cost uses LiteLLM's recorded contributor rates, with reasoning tokens charged at the output rate."
}
