{
  "$schema": "https://not-stbenjam.github.io/ramen-bench/schemas/run.schema.json",
  "schemaVersion": 1,
  "id": "anthropic/opus-5/max",
  "vendor": {
    "slug": "anthropic",
    "displayName": "Anthropic"
  },
  "model": {
    "slug": "opus-5",
    "displayName": "Opus 5",
    "providerModelId": "claude-opus-5"
  },
  "variation": {
    "slug": "max",
    "displayName": "Max",
    "reasoningEffort": "max",
    "parameters": {}
  },
  "harness": {
    "name": "Claude Code",
    "version": "2.1.261",
    "runtime": "Anthropic Claude Code CLI",
    "invocation": "Claude Code session using claude-opus-5; effort max"
  },
  "artifacts": {
    "result": "index.html",
    "transcript": "transcript.json"
  },
  "timing": {
    "startedAt": "2026-09-04T22:13:43.991Z",
    "completedAt": "2026-09-04T23:10:19.360Z",
    "wallDurationMs": 3395369,
    "apiDurationMs": 2613358
  },
  "usage": {
    "tokens": {
      "input": 2226,
      "cachedInput": 15007219,
      "cacheCreationInput": 260275,
      "reasoning": 113580,
      "output": 216578,
      "total": 15486298
    },
    "cost": {
      "currency": "USD",
      "total": 15.523395500000001,
      "estimated": false
    },
    "requests": 73,
    "turns": 1,
    "toolCalls": 72,
    "providerReported": true,
    "raw": {
      "source": "Claude Code final cost-state",
      "requestCountBasis": "unique recorded assistant message ids",
      "costState": {
        "totalCostUSD": 15.523395500000001,
        "totalAPIDurationMs": 2613358,
        "totalDurationMs": 14255508,
        "startTimeEpochMs": 1788560023255,
        "hasUnknownModelCost": false,
        "modelUsage": {
          "claude-haiku-4-5-20251001": {
            "inputTokens": 1986,
            "outputTokens": 30,
            "thinkingTokens": 0,
            "cacheReadInputTokens": 0,
            "cacheCreationInputTokens": 0,
            "webSearchRequests": 0,
            "costUSD": 0.002136
          },
          "claude-opus-5": {
            "inputTokens": 240,
            "outputTokens": 216548,
            "thinkingTokens": 113580,
            "cacheReadInputTokens": 15007219,
            "cacheCreationInputTokens": 260275,
            "webSearchRequests": 0,
            "costUSD": 15.521259500000001
          }
        }
      }
    }
  },
  "resultStats": {
    "bytes": 68129,
    "lines": 2083
  },
  "provenance": {
    "pricingSource": "Claude Code 2.1.261 final cost-state"
  },
  "notes": "Token and cost totals are the exact final Claude Code cost-state totals. The public transcript omits hidden thinking, private agent-mail activity, credentials, and private local path prefixes."
}
