{
  "$schema": "https://not-stbenjam.github.io/ramen-bench/schemas/run.schema.json",
  "schemaVersion": 1,
  "id": "openai/gpt-5.6-sol/ultra",
  "vendor": {
    "slug": "openai",
    "displayName": "OpenAI"
  },
  "model": {
    "slug": "gpt-5.6-sol",
    "displayName": "GPT 5.6 Sol",
    "providerModelId": "gpt-5.6-sol"
  },
  "variation": {
    "slug": "ultra",
    "displayName": "Ultra",
    "reasoningEffort": "ultra",
    "parameters": {}
  },
  "harness": {
    "name": "Codex CLI",
    "version": "0.153.2",
    "runtime": "OpenAI Codex CLI",
    "invocation": "codex exec --ephemeral --model gpt-5.6-sol --config model_reasoning_effort=ultra PROMPT.md"
  },
  "artifacts": {
    "result": "index.html",
    "transcript": "transcript.json"
  },
  "timing": {
    "startedAt": "2026-09-04T22:23:38.976Z",
    "completedAt": "2026-09-04T22:33:35.317Z",
    "wallDurationMs": 596341
  },
  "usage": {
    "tokens": {
      "input": 0,
      "cachedInput": 0,
      "cacheCreationInput": 0,
      "reasoning": 0,
      "output": 0,
      "total": 71371
    },
    "cost": null,
    "turns": 1,
    "toolCalls": 10,
    "providerReported": true,
    "raw": {
      "source": "Codex terminal tokens used summary",
      "totalTokens": 71371,
      "tokenCategoryBreakdownAvailable": false,
      "pricing": {
        "library": "litellm",
        "version": "1.83.7",
        "modelKey": "gpt-5.6-sol",
        "ratesUsdPerToken": {
          "input": 4e-06,
          "cachedInput": 4e-07,
          "cacheCreationInput": 5e-06,
          "output": 2e-05
        }
      },
      "costCalculation": {
        "status": "not_calculated_missing_token_categories",
        "reason": "The terminal record reports total tokens only; assigning input, cached input, reasoning, or output categories would require guessing."
      }
    }
  },
  "resultStats": {
    "bytes": 35779,
    "lines": 1000
  },
  "provenance": {
    "pricingSource": "LiteLLM 1.83.7 model_cost[gpt-5.6-sol] (rates retained; cost not calculated because token categories are unavailable)"
  },
  "notes": "The Codex terminal record reports an exact total token count without category breakdown. Input, cache, reasoning, and output fields remain zero and cost is unavailable rather than guessed. The public transcript contains recorded text and full recorded tool activity; hidden reasoning, credentials, and private local path prefixes are excluded."
}
